{
  "implementer_id": "example.agent.beta",
  "display_name": "Example Agent Beta",
  "declaration": {
    "url": "https://example.invalid/anab/example.agent.beta/conformance.json",
    "sha256": "1111111111111111111111111111111111111111111111111111111111111111"
  },
  "assurance_level": "AL3",
  "control_namespace": "ANAGB",
  "controls": [
    "ANAGB-RES-01",
    "ANAGB-AUTH-01",
    "ANAGB-A2A-07"
  ],
  "scope": {
    "baseline": "agent-name-assurance-baseline",
    "verification_tier": "AN-3",
    "conformance_profile": "Enterprise"
  },
  "artifacts": [
    {
      "uri": "https://example.invalid/anab/example.agent.beta/conformance.json",
      "media_type": "application/json",
      "sha256": "1111111111111111111111111111111111111111111111111111111111111111",
      "role": "declaration"
    },
    {
      "uri": "https://example.invalid/anab/example.agent.beta/evidence.json",
      "media_type": "application/json",
      "sha256": "2222222222222222222222222222222222222222222222222222222222222222",
      "role": "evidence"
    },
    {
      "uri": "https://example.invalid/oasf/evaluations/example-agent-beta.json",
      "media_type": "application/json",
      "sha256": "3333333333333333333333333333333333333333333333333333333333333333",
      "role": "evaluation"
    },
    {
      "uri": "https://example.invalid/decisions/example-agent-beta-001.json",
      "media_type": "application/json",
      "sha256": "aaaaaaaaaaaaaaaaaaaaaaaaaaaaaaaaaaaaaaaaaaaaaaaaaaaaaaaaaaaaaaaa",
      "role": "decision",
      "schema_uri": "https://raw.githubusercontent.com/sankarshanmukhopadhyay/trust-infrastructure-schemas/v0.8.0/decision/decision-receipt.schema.json",
      "notes": "Decision receipt linking policy, evidence, evaluation, and relying-party outcome."
    }
  ],
  "authority_boundary": {
    "statement": "Registry publication makes trust artifacts discoverable. It does not itself delegate operating authority.",
    "authoritative_party": "Example Registry Operator",
    "delegation_required": true,
    "revocation_actor": "Example Sponsor Authority",
    "scope": [
      "registry-discovery"
    ]
  }
}
